{
  "head": {
    "meta": {
      "keywords": "霍尔果斯炫动网络官网",
      "description": "霍尔果斯炫动网络官网",
      "author": "your-name@hoolai.com"
    },
    "title": "官网首页"
  },
  "header": {
    "logo": {
      "src": "http://cdn.hoolaiimg.com/group1/M00/00/2B/CgIJKlg-iz2ARC8SAAAjKGI-JWw474.png",
      "url": "./"
    },
    "nav": [{
      "name": "首页",
      "url": "./index.html"
    }, {
      "name": "关于我们",
      "url": "./about.html"
    }, {
      "name": "家长监护工程",
      "url": "./custody.html"
    }, {
      "name": "在线交易",
      "url": "./pay.html"
    }, {
      "name": "服务协议",
      "url": "./server.html"
    }, {
      "name": "隐私协议",
      "url": "./privacy.html"
    }, {
      "name": "纠纷处理",
      "url": "./dispute.html"
    }],
    "account": {
      "signup": {
        "name": "注册",
        "url": "./signup.html"
      },
      "signin": {
        "name": "登陆",
        "url": "./signin.html"
      },
      "logout": {
        "name": "注销",
        "url": "./logout.html"
      }
    }
  },
  "footer": {
    "copyright": "霍尔果斯炫动网络科技有限公司",
    "address": "新疆伊犁州霍尔果斯市北京路以西、珠海路以南合作中心配套区查验业务楼8楼8-13-85号"
  },
  "content": {
    "main": {
      "custody": {
        "title": "家长监护工程",
        "description": [],
        "content": [{
          "title": "网络游戏未成年人家长监护工程系统说明",
          "description": [{
            "content": "“网络游戏未成年人家长监护工程”是一项由六家网络游戏企业共同发起并参与实施，由中华人民共和国文化部指导，旨在加强家长对未成年人参与网络游戏的监护，引导未成年人健康、绿色参与网络游戏，和谐家庭关系的社会性公益行动。它提供了一种切实可行的方法，一种家长实施监控的管道，使家长纠正部分未成年子女沉迷游戏的行为成为可能。"
          }]
        }, {
          "title": "申请引导",
          "description": [{
            "content": "一、申请条件"
          }, {
            "content": "1、申请人需为被监护未成年人的法定监护人；"
          }, {
            "content": "2、申请人的被监护人年龄小于18周岁；"
          }, {
            "content": "3、申请人需为大陆公民，不含港、澳、台人士。 "
          }, {
            "content": "二、申请需要提交材料："
          }, {
            "content": "1、监护人信息表（包含监护人的身份证明复印件）；参见附表一 ",
            "attachment": {
              "content": "附件一",
              "url": "http://hegsxd.com/1.doc"
            }

          }, {
            "content": "2、被监护人信息表（包含被监护人所玩游戏相关信息及身份证明复印件）；参见附表二 ",
            "attachment": {
              "content": "附件二",
              "url": "http://hegsxd.com/2.doc"
            }
          }, {
            "content": "3、填写未成年人家长监护申请书、起诉保证书、授权书并手工签字（需下载，填写并打印，签字）；参见附表三 ",
            "attachment": {
              "content": "附件三",
              "url": "http://hegsxd.com/3.doc"
            }
          }, {
            "content": "4、申请人与被监护人的监护关系证明文件（户口簿或有关机关出具的证明文件）。"
          }, {
            "content": "账户疑义申请文档  ",
            "attachment": {
              "content": "附件四",
              "url": "http://hegsxd.com/4.doc"
            }
          }, {
            "content": "三、申请方式"
          }, {
            "content": "邮寄地址：新疆伊犁州霍尔果斯市北京路以西、珠海路以南合作中心配套区查验业务楼8楼8-13-85号    客服中心 收"
          }, {
            "content": "邮政编码：835221"
          }, {
            "content": "四、申请流程： "
          }, {
            "content": "申请人首先使用信件、来访等方式提交资料；受理公司在收到提交材料后，将在48小时内进行电话回访（不含法定节假日），由受理公司对内容进行核查。资料提交合格且核对正确的情况下，由受理公司对该请求予以受理；资料提交不全面的，由受理公司进行回访，并提示申请人继续补充材料；资料提交不合格且不正确的，受理公司有权对该请求予以拒绝，并附说明理由。"
          }, {
            "content": "五、其他要求："
          }, {
            "content": "1、申请人应提交较完备的申请材料，对未提供的信息要及时补充；可请熟知电脑、互联网、游戏的人员进行协助，以便提供详实资料；"
          }, {
            "content": "2、申请人应保证提交的信息真实有效；对于提供虚假信息或伪造证件，监护关系证明书追究法律责任的权利。"
          }]
        }, {
          "title": "家长监护服务说明",
          "description": [{
            "content": "家长监护工程充分考虑家长的实际需求，当家长发现自己的孩子玩游戏过于沉迷的时候，由家长提供合法的监护人资质证明、游戏名称账号、以及家长对于限制强度的愿望等信息，可对处于孩子游戏沉迷状态的账号采取几种限制措施，解决未成年人沉迷网游的不良现象，如限制孩子每天玩游戏的时间区间和长度，也可以限制只有周末才可以游戏，或者完全禁止。"
          }]
        }]
      }
    }
  }
}