{
  "head": {
    "meta": {
      "keywords": "霍尔果斯炫动网络官网",
      "description": "霍尔果斯炫动网络官网",
      "author": "your-name@hoolai.com"
    },
    "title": "官网首页"
  },
  "header": {
    "logo": {
      "src": "http://cdn.hoolaiimg.com/group1/M00/00/2B/CgIJKlg-iz2ARC8SAAAjKGI-JWw474.png",
      "url": "./"
    },
    "nav": [{
      "name": "首页",
      "url": "./index.html"
    }, {
      "name": "关于我们",
      "url": "./about.html"
    }, {
      "name": "家长监护工程",
      "url": "./custody.html"
    }, {
      "name": "在线交易",
      "url": "./pay.html"
    }, {
      "name": "服务协议",
      "url": "./server.html"
    }, {
      "name": "隐私协议",
      "url": "./privacy.html"
    }, {
      "name": "纠纷处理",
      "url": "./dispute.html"
    }],
    "account": {
      "signup": {
        "name": "注册",
        "url": "./signup.html"
      },
      "signin": {
        "name": "登陆",
        "url": "./signin.html"
      },
      "logout": {
        "name": "注销",
        "url": "./logout.html"
      }
    }
  },
  "footer": {
    "copyright": "霍尔果斯炫动网络科技有限公司",
    "address": "新疆伊犁州霍尔果斯市北京路以西、珠海路以南合作中心配套区查验业务楼8楼8-13-85号"
  },
  "content": {
    "carousel": [{
      "src": "http://cdn.hoolaiimg.com/group1/M00/00/29/CgIJKlfogeWAbJZmAALTKsqjajs799.jpg?v=0.0.1"
    }, {
      "src": "http://cdn.hoolaiimg.com/group1/M00/00/28/PBzLUVc6fvSAeUi8AAMYBqU2do0253.jpg?v=0.0.1"
    }],
    "main": {
      "privacy": {
        "title": "隐私权保护声明",
        "description": [{
          "content": "互爱互动（北京）科技有限公司（\"互爱\"、\"我们\"、\"我方\" 或 \"我们的\"）的名义表示，尊重本游戏平台访问者的隐私。 您与我们之间的隐私政策旨在告知您我们关于收集、使用和披露您通过游戏平台提交给我们的任何个人信息和匿名信息的政策和行为规范。"
        }, {
          "content": "互爱注重保护用户个人信息及个人隐私。本隐私权保护声明解释了用户个人信息收集和使用的有关情况，本隐私权保护声明适用于互爱的所有相关服务。"
        }],
        "content": [{
          "title": "您个人信息的收集",
          "description": [{
            "content": "互爱为用户提供游戏及相关服务。在您注册、使用互爱提供的游戏或相关服务时，经您的同意，我们收集与个人身份有关的信息，例如姓名、住址、手机号码等。如果您无法提供此类信息，可能会不能使用对应服务。"
          }, {
            "content": "我们也会基于优化用户体验的目的，收集其他有关的信息。例如当用户访问互爱游戏平台，我们收集哪些游戏的受欢迎程度、浏览器软件信息等以便优化我们的游戏平台服务。"
          }]
        }, {
          "title": "您个人信息的管理",
          "description": [{
            "content": "互爱会在如下情形使用您的个人信息：(1)符合法律法规的要求；（2）根据您的授权；（3）符合互爱相关服务条款、软件许可使用协议的约定；"
          }, {
            "content": "互爱不会未经允许向第三方披露您的个人信息。除非满足下述情形之一： (1)根据法律法规的规定；（2）符合您与互爱之间的相关服务条款、软件许可使用协议的约定；"
          }]
        }, {
          "title": "您个人信息的安全",
          "description": [{
            "content": "互爱严格保护您的个人信息安全。我们使用各种制度、安全技术和程序等措施来保护您的个人信息不被未经授权的访问、使用或泄漏。如果您对我们的个人信息保护有任何疑问，请联系我们。"
          }]
        }, {
          "title": "访问您的个人信息",
          "description": [{
            "content": "如果您注册了互爱相关服务，您可以查阅或编辑您提交给互爱的个人信息。一般情况下，您可随时浏览、修改自己提交的信息，但出于安全性和身份识别（如号码申诉服务）的考虑，您可能无法修改注册时提供的初始注册信息及其他验证信息。"
          }]
        }, {
          "title": "Cookie 的使用",
          "description": [{
            "content": "互爱使用 Cookie 来帮助您实现您的联机体验的个性化。Cookie 是由网络服务器存放在您的访问设备上的文本文件。指定给您的 Cookie 是唯一的，它只能被将 Cookie 发布给您的域中的 Web 服务器读取。"
          }, {
            "content": "我们可能使用「Cookies档案」收集用户对服务的使用数据，这样有助于用户再度到访网站时之用。「Cookies档案」是由网络服务器发出的一小段数据，储存于网络浏览器之中，使日后可从该浏览器阅读该段数据。目前，从Cookies档案收集到的资料用于提高服务的功能。互爱服务所提供的数据，是根据互爱就用户对服务的累积使用进行分析，然后加以组织和编排的。Cookies档案有助同时能使登入程序更顺畅更快捷，以及保存通话期之间的数据。"
          }, {
            "content": "您可以关闭您浏览器上的Cookies档案功能而不影响到您浏览游戏所在的游戏平台网站，但Cookies档案确实可使我们服务更方便。关闭Cookies档案功能可能会造成使用的复杂程度和涉及较多的输入手续。您亦应留意，若您清除Cookies档案功能，，则可能影响到互爱服务的某些功能。"
          }]
        }, {
          "title": "未成年人的个人信息保护",
          "description": [{
            "content": "互爱非常重视对未成年人个人信息的保护。若您是18周岁以下的未成年人，在使用互爱提供的服务前，应事先取得您家长或法定监护人的书面同意。互爱根据国家相关法律法规的规定保护未成年人的个人信息。"
          }, {
            "content": "互爱会不时更新本隐私权保护声明。我们会在游戏平台上发布对隐私权声明所做的变更内容。"
          }, {
            "content": "(全文完)"
          }]
        }]
      }
    }
  }
}